[
  {
    "code": "DAILY",
    "name": "Daily",
    "description": "Duration measured in days",
    "aliases": ["PER_DAY", "DAILY_BASIS"]
  },
  {
    "code": "WEEKLY",
    "name": "Weekly",
    "description": "Duration measured in weeks",
    "aliases": ["PER_WEEK", "WEEKLY_BASIS"]
  },
  {
    "code": "MONTHLY",
    "name": "Monthly",
    "description": "Duration measured in months",
    "aliases": ["PER_MONTH", "MONTHLY_BASIS"]
  },
  {
    "code": "QUARTERLY",
    "name": "Quarterly",
    "description": "Duration measured in quarters (3 months)",
    "aliases": ["PER_QUARTER", "QUARTERLY_BASIS"]
  },
  {
    "code": "ANNUALLY",
    "name": "Annually",
    "description": "Duration measured in years",
    "aliases": ["PER_YEAR", "YEARLY_BASIS"]
  }
]