[
  {
    "code": "APPLICATION",
    "name": "Application",
    "description": "Charge applies during application process",
    "aliases": ["APPLYING", "PRE_LEASE"]
  },
  {
    "code": "MOVE_IN",
    "name": "Move In",
    "description": "Charge applies at move-in time",
    "aliases": ["OCCUPANCY_START", "TENANT_START"]
  },
  {
    "code": "OCCUPANCY",
    "name": "Occupancy",
    "description": "Charge applies during tenant occupancy",
    "aliases": ["TENANT_OCCUPANCY", "ACTIVE_TENANCY"]
  },
  {
    "code": "MOVE_OUT",
    "name": "Move Out",
    "description": "Charge applies at move-out time",
    "aliases": ["OCCUPANCY_END", "TENANT_END"]
  }
]