[
  {
    "code": "REQUIRED",
    "name": "Required",
    "description": "Charge is mandatory for all tenants",
    "aliases": ["MANDATORY", "OBLIGATORY"]
  },
  {
    "code": "OPTIONAL",
    "name": "Optional",
    "description": "Charge is optional and tenant may choose to pay",
    "aliases": ["ELECTIVE", "CHOICE"]
  },
  {
    "code": "CONDITIONAL",
    "name": "Conditional",
    "description": "Charge applies only under specific conditions",
    "aliases": ["SITUATIONAL", "CONTINGENT"]
  }
]